{
  "algorithm": "dagre",
  "direction": "TB",
  "breakpoints": {
    "desktop": {
      "nodes": {
        "html-basics": { "x": 200, "y": 100, "width": 160, "height": 80 },
        "css-basics": { "x": 200, "y": 220, "width": 160, "height": 80 },
        "javascript-basics": { "x": 200, "y": 340, "width": 160, "height": 80 },
        "react-basics": { "x": 200, "y": 460, "width": 160, "height": 80 },
        "typescript": { "x": 400, "y": 380, "width": 160, "height": 80 }
      },
      "groups": {
        "fundamentals": { "x": 150, "y": 50, "width": 260, "height": 380 },
        "frameworks": { "x": 150, "y": 440, "width": 260, "height": 120 },
        "advanced": { "x": 370, "y": 360, "width": 220, "height": 120 }
      }
    }
  },
  "groups": [
    {
      "id": "fundamentals",
      "title": "Web Fundamentals",
      "nodes": ["html-basics", "css-basics", "javascript-basics"],
      "color": "#3b82f6"
    },
    {
      "id": "frameworks",
      "title": "Frontend Frameworks",
      "nodes": ["react-basics"],
      "color": "#10b981"
    },
    {
      "id": "advanced",
      "title": "Advanced Topics", 
      "nodes": ["typescript"],
      "color": "#f59e0b"
    }
  ]
}